{
  "schema_version": "SignedScienceClaimBundle.v0",
  "signature_or_digest": "sha256:missing-assumption-set",
  "verification_result": {
    "schema_version": "VerificationResult.v0",
    "id": "vr-1",
    "created_at": "2026-05-01T12:00:00Z",
    "producer": "provability-fabric",
    "producer_version": "0.1.0",
    "source_repo": "https://github.com/SentinelOps-CI/provability-fabric",
    "source_commit": "abc123def456",
    "status": "ProofChecked",
    "signature_or_digest": "sha256:vr",
    "overall_outcome": "pass",
    "checks": [{ "id": "c1", "name": "ok", "outcome": "pass" }]
  },
  "science_claim_bundle": {
    "schema_version": "ScienceClaimBundle.v0",
    "created_at": "2026-05-01T11:30:00Z",
    "producer": "LabTrust-Gym",
    "producer_version": "0.1.0",
    "source_repo": "https://github.com/fraware/LabTrust-Gym",
    "source_commit": "bad-commit",
    "status": "RuntimeChecked",
    "signature_or_digest": "sha256:bundle",
    "claim": {
      "schema_version": "ClaimArtifact.v0",
      "id": "claim-no-assumption-set",
      "created_at": "2026-05-01T11:00:00Z",
      "producer": "LabTrust-Gym",
      "producer_version": "0.1.0",
      "source_repo": "https://github.com/fraware/LabTrust-Gym",
      "source_commit": "bad-commit",
      "status": "RuntimeChecked",
      "signature_or_digest": "sha256:claim",
      "claim_text": "Missing assumption set.",
      "guarantee_types": {}
    },
    "runtime_receipt": {
      "schema_version": "RuntimeReceipt.v0",
      "id": "receipt",
      "created_at": "2026-05-01T11:00:00Z",
      "producer": "LabTrust-Gym",
      "producer_version": "0.1.0",
      "source_repo": "https://github.com/fraware/LabTrust-Gym",
      "source_commit": "bad-commit",
      "status": "RuntimeChecked",
      "signature_or_digest": "sha256:receipt"
    },
    "trace_certificate": {
      "schema_version": "TraceCertificate.v0",
      "id": "cert",
      "created_at": "2026-05-01T11:00:00Z",
      "producer": "CertifyEdge",
      "producer_version": "0.1.0",
      "source_repo": "https://github.com/fraware/CertifyEdge",
      "source_commit": "bad-commit",
      "status": "CertificateChecked",
      "signature_or_digest": "sha256:cert"
    }
  }
}
